{
  "schema_version": 1,
  "module_id": "module-03",
  "system_id": "system-a",
  "state": "ready",
  "selector": "SATELITE",
  "role": "satellite",
  "position": {
    "x": -1,
    "y": 0
  },
  "rotation": 90,
  "targets": [
    {
      "target_index": 1,
      "state": "safe",
      "enabled": true
    },
    {
      "target_index": 2,
      "state": "safe",
      "enabled": true
    },
    {
      "target_index": 3,
      "state": "safe",
      "enabled": true
    },
    {
      "target_index": 4,
      "state": "safe",
      "enabled": true
    },
    {
      "target_index": 5,
      "state": "safe",
      "enabled": true
    },
    {
      "target_index": 6,
      "state": "safe",
      "enabled": true
    },
    {
      "target_index": 7,
      "state": "safe",
      "enabled": true
    },
    {
      "target_index": 8,
      "state": "safe",
      "enabled": true
    },
    {
      "target_index": 9,
      "state": "safe",
      "enabled": true
    }
  ],
  "queue_depth": 0,
  "last_command": {
    "command_id": "ad506082-af5e-4d6c-bf71-5e6f70819203",
    "result": "accepted"
  },
  "firmware_version": "0.1.0",
  "uptime_s": 3600
}
